{
    "voornamen" : "Martin Maarten",
    "voorvoegsel" : "de",
    "achternaam" : "Visser",
    "geboortedatum" : "1944-06-11",
    "bsn" : "444444440",
    "adresBrp" : {
        "straatnaam" : "Zomerdijkstraat",
        "huisnummer" : 19,
        "huisletter" : "G",
        "huisnummertoevoeging" : "III",
        "postcode" : "1079WZ",
        "woonplaatsnaam" : "Amsterdam",
        "aanduidingBijHuisnummer" : "de trekbel",
        "locatieomschrijving" : "Bij het hek recht omhoog"
    },
    "postadresBrp" : {
        "straatnaam" : "",
        "huisnummer" : 0,
        "huisletter" : "",
        "huisnummertoevoeging" : "",
        "postcode" : "",
        "woonplaatsnaam" : "",
        "aanduidingBijHuisnummer" : "",
        "locatieomschrijving" : ""
    },
    "verblijfplaatsHistorisch": [
        {
            "type": "WOONADRES",
            "adres": {
                "postcode": "2511BT",
                "huisletter": "a",
                "huisnummer": 70,
                "straatnaam": "Spui",
                "woonplaatsnaam": "'s-Gravenhage",
                "locatieomschrijving": "",
                "huisnummertoevoeging": "Huis",
                "aanduidingBijHuisnummer": ""
            },
            "datumBeginAdreshouding": "2025-12-09"
        },
        {
            "type": "POSTADRES",
            "adres": {
                "postcode": "2511BD",
                "huisletter": "",
                "huisnummer": 4,
                "straatnaam": "Lange Poten",
                "woonplaatsnaam": "Den Haag",
                "locatieomschrijving": "",
                "huisnummertoevoeging": "",
                "aanduidingBijHuisnummer": ""
            },
            "datumBeginAdreshouding": "2024-05-01"
        }
    ],
    "verblijfstitel" : {
        "codeVerblijfstitel" : {
            "code" : "-1",
            "name" : ""
        },
        "datumAanvangVerblijfstitel" : "",
        "datumEindeVerblijfstitel" : ""
    },
    "nationaliteiten" : [ ],
    "kinderenBsns" : [ ],
    "datumOverlijden" : ""
}