{
    "voornamen" : "Henk",
    "voorvoegsel" : "de",
    "achternaam" : "Jansen",
    "geboortedatum" : "1960-07-20",
    "bsn" : "111111110",
    "adresBrp" : {
        "straatnaam" : "Zomerdijkstraat",
        "huisnummer" : 19,
        "huisletter" : "C",
        "huisnummertoevoeging" : "Huis",
        "postcode" : "1079WZ",
        "woonplaatsnaam" : "Amsterdam",
        "aanduidingBijHuisnummer" : "",
        "locatieomschrijving" : ""
    },
    "postadresBrp" : {
        "straatnaam" : "Kerkstraat",
        "huisnummer" : 79,
        "huisletter" : "A",
        "huisnummertoevoeging" : "Huis",
        "postcode" : "2054RC",
        "woonplaatsnaam" : "Utrecht",
        "aanduidingBijHuisnummer" : "",
        "locatieomschrijving" : ""
    },
    "verblijfplaatsHistorisch": [
        {
            "type": "WOONADRES",
            "adres": {
                "postcode": "2511BT",
                "huisletter": "a",
                "huisnummer": 70,
                "straatnaam": "Spui",
                "woonplaatsnaam": "'s-Gravenhage",
                "locatieomschrijving": "",
                "huisnummertoevoeging": "Huis",
                "aanduidingBijHuisnummer": ""
            },
            "datumBeginAdreshouding": "2025-12-09"
        },
        {
            "type": "POSTADRES",
            "adres": {
                "postcode": "2511BD",
                "huisletter": "",
                "huisnummer": 4,
                "straatnaam": "Lange Poten",
                "woonplaatsnaam": "Den Haag",
                "locatieomschrijving": "",
                "huisnummertoevoeging": "",
                "aanduidingBijHuisnummer": ""
            },
            "datumBeginAdreshouding": "2024-05-01"
        }
    ],
    "verblijfstitel" : {
        "codeVerblijfstitel" : {
            "code" : "41",
            "name" : ""
        },
        "datumAanvangVerblijfstitel" : "2012-09-15",
        "datumEindeVerblijfstitel" : "2024-09-15"
    },
    "nationaliteiten" : [ ],
    "kinderenBsns" : [ "243000157", "243000017", "010002546", "080000071" ],
    "partnerBsn" : "999991954",
    "datumOverlijden" : ""
}